{
  "schema_version": "1.0.0", "suite_version": "1.0.0", "backend": "tiny",
  "qwen": {"model_asset": "qwen_model", "tokenizer_asset": "qwen_tokenizer", "run_mode": "initial_exact_cache", "streaming": false, "decode": false, "packing": false, "padding": "none", "attention_mask": "all_ones"},
  "baseline": "gdn2_native", "mechanism": "corrected_momentum", "variant": "corrected_momentum",
  "task": {"name": "drift_reversal", "params": {}},
  "seeds": [11, 29, 47], "budget": {"tokens": 120, "updates": 20},
  "optimizer": {"name": "adamw", "learning_rate": 0.005, "betas": [0.9, 0.95], "eps": 1e-8, "weight_decay": 0.01},
  "schedule": {"name": "cosine", "warmup_updates": 2},
  "model": {"hidden_size": 16, "num_layers": 2, "num_heads": 2, "state_key_dim": 4, "state_value_dim": 4, "ffn_dim": 32, "ffn_match_lower": 16, "ffn_match_upper": 48},
  "lengths": {"curriculum": [2, 4], "extrapolation": [8, 16]},
  "evaluation": {"primary_metric": "adaptation_lag", "direction": "minimize"},
  "thresholds": {"min_useful_addition": 0.02, "min_reliance": 0.1, "equivalence_tolerance": 0.01, "harm_threshold": 0.03, "synergy_threshold": 0.02},
  "promotion": {"min_gate_mean": 0.005, "min_gate_max": 0.02, "min_persistent_hit_rate": 0.25, "min_conditional_read_accuracy": 0.5, "min_shuffled_cache_dependence": 0.05, "min_adjacent_capacity_lcb": 0.05},
  "protected_metrics": [{"name": "validation_loss", "max_regression": 0.01}],
  "device_preferences": ["cuda", "cpu"], "dtype_preferences": ["bfloat16", "float32"],
  "required_stage": "mechanism_screen",
  "cache": {"width": 2, "block_size": 2, "score": "exact_outer", "read": "unit_l2", "read_init": "gamma_one_sink_zero_amplitude_zero", "eps_cache": 1e-6, "coordinate_frame": "rotated_recurrence", "pre_rotation_diagnostic": false, "storage_dtype": "bf16", "compute_dtype": "fp32", "inclusive": true, "tie_policy": "score_desc_position_desc", "lr_cache": 0.005, "weight_decay_cache": 0.0},
  "runtime": {"output_path": "outputs/corrected-momentum-screening", "device_ordinal": 0}
}
