{
  "schema_version": "1.0.0",
  "suite_version": "1.0.0",
  "backend": "tiny",
  "qwen": {
    "model_asset": "qwen_model",
    "tokenizer_asset": "qwen_tokenizer",
    "run_mode": "initial_exact_cache",
    "streaming": false,
    "decode": false,
    "packing": false,
    "padding": "none",
    "attention_mask": "all_ones"
  },
  "baseline": "gdn2_native",
  "mechanism": "exact_cache",
  "variant": "top_surprise",
  "task": {
    "name": "structured_exceptions",
    "params": {"exception_fraction": 0.25}
  },
  "seeds": [11, 29, 47, 71, 97],
  "budget": {"tokens": 2048, "updates": 64},
  "optimizer": {
    "name": "adamw",
    "learning_rate": 0.002,
    "betas": [0.9, 0.95],
    "eps": 1e-8,
    "weight_decay": 0.01
  },
  "schedule": {"name": "cosine", "warmup_updates": 4},
  "model": {
    "hidden_size": 64,
    "num_layers": 4,
    "num_heads": 4,
    "state_key_dim": 16,
    "state_value_dim": 16,
    "ffn_dim": 128,
    "ffn_match_lower": 96,
    "ffn_match_upper": 160
  },
  "lengths": {"curriculum": [8, 16], "extrapolation": [32, 64]},
  "evaluation": {"primary_metric": "exception_accuracy", "direction": "maximize"},
  "thresholds": {
    "min_useful_addition": 0.02,
    "min_reliance": 0.1,
    "equivalence_tolerance": 0.01,
    "harm_threshold": 0.03,
    "synergy_threshold": 0.02
  },
  "promotion": {
    "min_gate_mean": 0.005,
    "min_gate_max": 0.02,
    "min_persistent_hit_rate": 0.25,
    "min_conditional_read_accuracy": 0.5,
    "min_shuffled_cache_dependence": 0.05,
    "min_adjacent_capacity_lcb": 0.05
  },
  "protected_metrics": [
    {"name": "rule_accuracy", "max_regression": 0.01},
    {"name": "validation_loss", "max_regression": 0.01}
  ],
  "device_preferences": ["cuda", "cpu"],
  "dtype_preferences": ["bfloat16", "float32"],
  "required_stage": "tiny_promotion",
  "cache": {
    "width": 4,
    "block_size": 4,
    "score": "exact_outer",
    "read": "rmsnorm",
    "read_init": "gamma_one_sink_zero_amplitude_zero",
    "eps_cache": 1e-6,
    "coordinate_frame": "rotated_recurrence",
    "pre_rotation_diagnostic": false,
    "storage_dtype": "bf16",
    "compute_dtype": "fp32",
    "inclusive": true,
    "tie_policy": "score_desc_position_desc",
    "lr_cache": 0.002,
    "weight_decay_cache": 0.0
  },
  "runtime": {"output_path": "outputs/promotion", "device_ordinal": 0}
}
